tool_dir,tool_name,ok,cache_hit,execution_mode,duration_s,observation_count,artifact_count,query,input_summary,result_summary,request_path,result_path,summary_path,timing_path
01_generic_purpose,generic_purpose,True,False,executed,60.7603,37,0,"Using the first physical-contact moment already grounded around 24 to 28 seconds, compare the music at that moment against these four descriptions: A single extremely loud short chord by the entire orchestra; complete stop of the music; rapidly descending string notes; only brass playing a single piercing high note. Identify which description is the closest supported match, and explicitly state whether the music continues after the accent, whether the strings are descending or not, and whether the sound is brass-only or broader orchestral.",,Thinking Process: 1. **Analyze the Request:** * Task: Answer a query about a specific musical moment in a video (opera scene) based on provided evidence and context. * Query: Compare the music at the first physical-co...,tools/01_generic_purpose/request_full.json,tools/01_generic_purpose/result.json,tools/01_generic_purpose/summary.md,tools/01_generic_purpose/timing.json
01_visual_temporal_grounder,visual_temporal_grounder,True,True,cache_hit,0.0,3,0,opera stage scene where the woman in a black gown and spiked crown escalates from angry singing and gesturing to physically touching or grabbing the other woman in a light dress or lying on the couch,top_k=3,"The queried event appears at: 13.00s-28.00s, 61.00s-81.00s, 94.00s-119.00s.",tools/01_visual_temporal_grounder/request_full.json,tools/01_visual_temporal_grounder/result.json,tools/01_visual_temporal_grounder/summary.md,tools/01_visual_temporal_grounder/timing.json
02_audio_temporal_grounder,audio_temporal_grounder,True,False,executed,46.6945,3,0,"sudden loud orchestral accent, abrupt stop, or sharp dramatic musical intensification at the moment of physical contact on stage","clips=13s-28s, 61s-81s, 94s-119s","SpotSound localized 1 candidate audio interval(s) for 'sudden loud orchestral accent, abrupt stop, or sharp dramatic musical intensification at the moment of physical contact on stage': 24.000-27.944s. SpotSound local...",tools/02_audio_temporal_grounder/request_full.json,tools/02_audio_temporal_grounder/result.json,tools/02_audio_temporal_grounder/summary.md,tools/02_audio_temporal_grounder/timing.json
03_dense_captioner,dense_captioner,True,False,executed,133.9533,152,30,,"clips=13s-28s, 61s-81s, 94s-119s","clips: 13s-28s, 61s-81s, 94s-119s",tools/03_dense_captioner/request_full.json,tools/03_dense_captioner/result.json,tools/03_dense_captioner/summary.md,tools/03_dense_captioner/timing.json
04_dense_captioner,dense_captioner,True,True,cache_hit,0.0,149,30,,"clips=24s-27.944s, 74.1s-80.98s, 107.4s-117.4s","clips: 24s-27.944s, 74.1s-80.98s, 107.4s-117.4s",tools/04_dense_captioner/request_full.json,tools/04_dense_captioner/result.json,tools/04_dense_captioner/summary.md,tools/04_dense_captioner/timing.json
